"very pleasant service, nice place but full deception with food. i travel a lot in many countries, italy too & its the worse i ever tested. lasagna without any taste at all, tiramisu still frozen in the plate, what a pity."
"the restaurant is situated at the south of amsterdam, named as amstelveen district. as the district does not have too many prime options, this place comes to top destinations in terms of ambiance. indoor and outdoor sitting options together with the design increases your expectatio "
"be aware the service staff is totally not trained or have even any experience, you have to wait a long time for your food, one point of time te waiter go and redo te string of his shoes without washing his hands he take the cutleries and serve the table i told mij wijf look at this and guess what happen he served our table i went en clean the cutleries first, than at 21.30 hr a whole tray of beer went in to the kitchen and all kitchen staff started to drink beer and wines. as said its manage as family business without service. the restaurant is so noisy and on top of this every 20 minutes your loud throughout the restaurant the happy birthday songs voor children parties of adult dinners , you want to have a nice dinner without stress this is sure not the place as the tables are packed on each other for that even the food is quite good but the rest you have to forget."
"this restaurant is a prime location for gorden ramsey to save! if you want to spend alot of money for an unripe tomatoe and fake mozerrela passing as bufola , wait two hours for soggy pasta in a puddel of canned tamatoe sause bought at the local supermarkt, be my guest as you will not be theirs as they do not care about you ,at all! the service was arrogant, extremely slow,and unresponsive. do youself a favor and look somewhere else. the are some great restaurants in the area, this is certianly not one."
"i went for take away pizza here in corona time. they were open for business which deserves a compliment. i wish i could say the same about the pizza. it was well below par - tasteless pie and cheap ingredients. i don’t know it this is related to the corona times, but i fear not. not recommended - there is plenty much better pizza around"
"we ordered pizza at home, it was disgusting. the ingredients are cheap as hell how dare you calling mozzarella a cheap cheese? never again, there are so many good places to eat, stay away from this one.."
"first time nearby town decided to try out this restaurant.  food: average, too much salt on my rib eye. overall texture was good.  the tiramisu is nice, balance taste and soft.  ambience: overall very comfortable environment, good for family gathering place. nice backyard."
"ambience of the restaurant was nice, service staff friendly.. unfortunately the food was. it up to m "
"nice ambiance. terribly slow service. staff does not look around to see if anyone needs service. we had to chase up staff for every step of the way: our first drink, for a menu-card, for ordering the food, for a dessert-menu card, for the dessert. my own main course was fine; my partners was much too salty. after again having had to wait for 10 minutes for someone to order our dessert we decided to leave without the dessert as no one was paying any attention to our attempts to snare a staff member. our total visit lasted 90 minutes in which we managed to drink 2 glasses of wine and have a main course; most of the time was spent on waiting and trying to attract attention from the staff. as no staff paid any attention we left our table to get the bill and pay at the till, where the staff member had the temerity to state we had only had to wait 5 minutes before being serv "
the restaurant is a genuine italian one with italian staff. the friendliness and service that i know from restaurants in italy is not reflected in this pla 
"table service up to italian standards as experienced in italy,by us italy love "
"with a colleague of mine we decided to have a dinner here during a business trip, after learning that the food was excellent. when we entered the restaurant we were not impressed by the atmosphere inside, which seemed a bit old and not entirely proper. the garden, however, was amazing and we sat outside with pleasure. it was a spacious garden with green view and wonderful sunshi "
"we came to the netherlands for a few days with my girlfriend. opposite our hotel there was this pizzeria. what a bad experience. the person who works there, the cook and the owner are all 1 person. loves money and only wants money. because he has no passion for food. how sad. ordered pizza and pasta that have nothing to do with italy. we were also not allowed to pay by card. the pin device was not on. we had to pay in cash. obliged. kind of scam. stay away from here"
this is honestly really awful. you cant call this pizzeria. pizza was really small compare to the amount. cheese was dirty and gross. supermarket pizza from the freezer tastes better than this. for all people this is really bad. last time here. not recommended
"small restaurant in the middle of amstelveen, right outside amsterdam. parking is a bit sketchy if you come by car. the restaurants interior is ok but nothing to write home about. we were there about 2 hours ago so everything is still fresh in my mind. because were a friday evening the restaurant was packed and extremely noisy. making a reservation is recommended. my wife and i had read good reviews so we went in with expectatio "
it was nice pizza and vibe but the manager was quite rude to the family beside us taking away the menus for the desert because they spent too much time make the pizza. the manager was verbally fighting back and not showing respect to the customers 
"kai the manager was already so rude on the phone that we were repelled straight away. even for dutch standards this is absolutely poor. asking me on the phone what time i want to join, me telling the time and then being told that actually theyre fully booked is not okay. why even bother to ask me then?! and then giving me a speech. not okay. either you have a table or not, but then please say so straight away and dont talk back to your guest and give an attitude."
"when we arrived the restaurant was full with families with kids. but we were offered a table at the window. they sell wine only by the glass of bottle, no caraf. the wine was great. they serve only pizza and no pasta. we ordered the diavola and four chees "
"i had a terrible experience with this pizza place today (order 13862907 made at amstelveen location - eleanor rooseveltlaan 2, 1183 cl amstelveen). even after waiting for more than 2 hours, did not get the pizza. however this is not the concern as this can happen at any shop and place, but what is concerning was the behavior of the delivery guy. this is the sequence of even "
"ordered side dishes and a dessert for delivery. website did not mention order must contain a pizza, and the order went through. waited for 1,5 hour then called and apparently our order was cancelled. they did not call/text/mail but thought it would be okay to let us starve..."
wanted to try something new - usually order from another place. pizza arrived half hour late and cold. when i called for complaining the operator put the phone on me. never use them again.... really sad to see such poor service. not sure if the franchise owner knows what is going on in amstelveen but it would be worth them to check in my opinion and do something - suggest to help stuff in better planning resources and send the operator to a ‘customer service 0.1 for beginners’ course...
"friday night dinners mostly consists of take-outs in our household. even though we do have our favourites were always keen to try new places. papa johns, even though part of a big american fast food chain opened in amstelveen recently so, we thought wed give it a go. walking in, there were quite a few glum looking people who seemed to have been waiting for some time. once you placed your order, a label with your name an order number is stuck on pizza boxes and then you wait...and wait. we went to albert hein close by to do a small shop, came back and waited some more. after another 15 minutes i was ready to ask for my money back but my son asked me to be patient. after about 45 min in total we got our pizzas and some sides. i must also add that the place lacks atmosphere with the staff moving about like theyre at a funeral...depressing to say the least! also, they dont use a wood fired oven but one of those cheap & nasty conveyor pizza ovens. getting home i expected the worst and wasnt disappointed...the pizzas were absolutely horrible! soft doughy soft base and the tomato sauce sour with a mingy amount topping...yuck "
"unpolite service, tasteless ingredients and terrible pizza. greasy cheese and soggy base. not recommended."
"nothing great to mention, staff isnt professional. not kip options to select from. its rather bland in nature with a crumpled sitting."
"it wasnt great at all, lacked salt. staff however was courteous. no kip item so to mention.  ..  .  .  ."
"this is one of the few real pizzerias in amstelveen. we visited it quite a few times and the atmosphere is relaxed and child friendly. the pizzas are of a good quality and thave he right size. the only thing i don’t understand is the change in the wine policy. formerly one could order wine in in a caraf of 0.25, 0.50 and 1.00 cl, but now you can order only bottles of wine. this not only is much more expensive but also offers less flexibility. so please change it!"
"once upon a time this was a nice, cheap and cheerful neighbourhood italian bistro but that time sadly appears to be gone. tasteless, awful, inedible food that for a large part appears to have been bought-in from some second-rate cash and carry outlet before being inexpertly warmed up. the waiter didnt seem to be at all surprised all three of the diners plates went back largely untouched, so i dont think think the current car crash is a sudden phenomenon."
"feels genuinely italian - children very welcome, you can watch the pizza dough being spun, pasta and risotto dishes very tasty."
"i dont recommend this restaurant for asiana family. we went there, and the waitresses treated us very rude. it was a kind of discrimination i feel. the treat local dutch people very nice, but not to asiana. i dont suggest asiana people to visit this restaurant."
"we visited this restaurant twice and both times the service was bad. very unfriendly and rude staff, but the food is really good."
"don’t go to this restaurant after 9:00 because you will probably get rude treatment. my husband and i were craving good italian so we came here. we arrived quite late because we were traveling far, so we understood the inconvenience. when we came in, everyone stared at us like we were the worst for coming in that late. we asked the waitress if it was too late and said we didn’t have to stay, but she said “we’re happy you’re here” and looked like she meant it so we thought, “great we’ll have a nice dinner but eat quickly so they don’t have to stay late for us. that was the last bit of friendliness we received. they sat us in the corner and took so long to bring menus or drinks. everyone else in the almost full restaurant was enjoying themselves and still eating when we sat down. the main waiter was refilling wine glasses, bringing people complimentary chocolates and laughing with other customers. obviously not in a hurry to leave. but he did not acknowledge us or welcome us. he just came by with a paper and looked at us to take our order. when he took it he left without a smile. we spent about $55 for the most uncomfortable, nice tasting italian food we’ve ever had. all we wanted to do was leave. they made us feel so out of place. we ate and left before some of the others had even finished their wine and they were still cold to us as we left. we couldn’t help but notice the waiter brought everyone a plate of chocolates with their check, but never brought us one. the food was fine but not worth it for our horrible experience. my husband ordered the pumpkin ravioli which doesn’t have meat but was still 16 euros. it was very good, but i ordered a pasta with “bacon” which ended up being thick pieces of pork that had a strange flavor. me least favorite meal of the whole trip. "
very popular restaurant  but the children enjoyed. not a brilliant location but near lots of housing.  service was good.
a friend wanted to eat itali 
"veri sapori´s main attraction is passionate owner mario bianco. he´s a fun host and our first visit a year ago was a great experience. sadly, it seems the rave reviews soon after opening this restaurant has lead to complacancy. our last visit this month was a major disappointment. our waiter seemed uninterested. his choice of wine was totally off and the dishes were ok, but otherwise uninspiring. we could have done better cooking ourselves and we´re no master chefs. as the prices are quite hefty, we expect better from mario!"
if you can live with some traditional slow dutch service the food will compensate. fantastic pastas with the spaghetti vengole as the clear favorite in a nice ambiance with a lot of people despite the fact that we booked a table already at 1800. we will most likely be back but not at peak hours...
picture th 
food is very good but it takes very long till it’s delivered. very kind service! but very bad wifi. but the workers are very kind!
nothing special to say. an italian like so many others. their pizza was a bit too salty and prices are more on the high side for the quality. but ok got to fast although the restaurant was busy and the staff is rather courtious.
ordered via thuisbezorgd (home delivery) a cafoncella pizza. it was super salty and prosciutto di parma was just a normal ham you put on your bread in the morning. also my friend ordered salami pizza but it was just normal salami looking ham.
"we have been in this restaurant many times and love the food. however, they charge extra for things that leaves a bad feeli "
"we received delivery pizza from this place and it was inedible, we threw it in the bin and called the restaurant to complain. the base was limp, stale and tasteless, the topping was like lumps of salt in chewy cheese."
"we made a reservation for 8 persons, including a 9 month old baby. requested a child seat, not an iss "
"for an italian restaurant, i would say on average the food was disappointing. the main course fish was very good, the arancini i had as a starter were tasteless. wine was nice and the staff are very friendly but not very experienced and didnt seem to have much training. location looked nice but we only got a seat in the bar area as the main restaurant with the nice view was full."
do you visit fortezza for the italian food or the locati 
"we visited this restaurant about 5 times overall for drinks and snacks, and had a full course dinner twi "
"terrace on a great location in lemmer. had the pizza, which was ok. the staff was very young, and they didnt always seem to be able to take care of the guests."
"sorry, maybe next time "
"we went here for a second try after a mediocre experience before. the atmosphere is nice, but suffers a bit from the locations design with the open kitchen in the middle and the noise which comes with it especially when it is crowd "
after waiting for 20+ minutes on just one drink before anyone cared to take our order. then we waited for 50 more minutes only to find out that they had completely forgotten about us. as you can imagine i do not advice going there if you actually want to eat. 
i had the pizza marinara and it was ok but relied too heavily on tinned fish. the vegetable lasagne was better. the service was not very good; there being one person other than the cook doing everything. and he struggled. it was a cold wet monday when we visited so i expect they were not anticipating the ten customers there.
"with 2 friends (total a party of 4) and a bill of 180 for a small piece of meat for me, a large piece of salmon and 2 plates of pasta. the potatoes were old and the sauces were so, so. the waiter was friendly but his co-worker (a young lady of about 25) was very insecure. no typical italian atmosphere. the website looks fine, the menu looks fine, but in th real world: i am never going back to that restaurant. not worth. no value for money."
"the restaurant is now called “trattoria italiana diga”. my review? terrible service and terrible food! we sat at the terrace as the weather was quite good (for april). the waitress came quite quickly to take our order (spaghetti with mussels and gambas, spaghetti with tomato sauce (kid portion) and a pizza tonno). the two orders of spaghetti arrive. first comment: i asked mine to be served with spicy sauce. never ate such a blend spaghetti even after adding more salt and pepper. impossible to eat it. my husband’s pizza was nowhere to be seen even after 10 min of our orders being served. we waited and waited, until i decided to call again the waitress (another one came). we asked for the pizza, spicy olive oil and parmesan. we had to wait another 10 min until the pizza arrived (letting us guess that the order had never been placed). the spicy olive oil? i had to ask for it again (btw: my pasta was served with just half a dozen gambas, the mussels were missing in combat!). the parmesan? never came. the pizza was as blend as my spaghetti and the lack of “spicy” in the spicy olive oil didn’t help in my already stretched patienc "
"went there for diinner because we saw the menu posted outside and it looked great. a waiter greeted us and told us to have a seat anywhere and he would find us. we seated ourselves and never saw the waiter again. after about ten minutes of waiting to be served and our dirty table cleaned, we finally had to flag down a waiter to order. we placed our order and the food was deliverd by another waiter. we ate our complete meal without anyone asking how our meal was or do we need anything else. i looked for a waiter to get our check and finally we got the attention of a person and they told us to go inside to pay. and by the way, we asked for a couple of glasses of tap water and was told that was not available, only by the bottle for sale. yes, they got us.. i eneded up buying one without asking the price...5 euros. we are here in town for 4 more nights and we wont return."
"very nice place, but after 1h i’m still sitting here and no one has served us anything. asked once to the blond waitress working on saturdays and i have to say i’m amazed by how rude she was. about the food i have no clue, i’ll let you now if they bring it."
really bad service. we’ve waited for 45min and nothing was served. i’ll never come back and seriously won’t recommend.
the service was slow. not enough staff on the floor. asked which cheeses were on the plate. waiter didntt know. had as main course pasta 4 formagi. no flavour on it and when i said that to the waiter. i got extra gratin cheese to give it a little bit of flavour. the interieur is out dated. they have a wonderfull place. hopefully they make something out of this. by
"i have been quite a few times to this restaurant and the pizzas have always been good (see my review from january 2015 which was very positive). my visit yesterday however will be my last. the pizza menu has drastically changed, and not for the better. the choice includes some very strange combinations, none of which appealed to me. i made my own choice of topping therefore (i used to order their fine frutti do mare). the pizza that arrived was very poor indeed. thin base, barely cooked on the middle, a smear of tomato sauce and a topping very meager on the fish front. there should have been salmon, mussels and anchovies but almost none of the above were to be found. what was a lot of were cherry tomatoes, olives and basil leaves. possibly the worst pizza i have every eat "
"the atmosphere is quite nice and cosy, waitresses were friendly and attentive even though it was bu "
"okay, this is one of the few restaurants in town, so it is always a take it or leave i "
nice patio out front to watch the people go by in this little town. we were there for lunch and only had sandwiches but the italian menu looked to have a large selection. service was okay they seem to either own the other few restaurants on the street as the waitress kept running back and forth between them and they had to run next door to get the credit card machine.
"trattoria artusi is located in the bilderberg hotel in oosterbeek. the location is stunning, beautiful hotel surrounded by nature and plenty of free parking spaces. the restaurant has a good ambiance, comfortable seats and excellent lighting. the service is good, well trained waiters with knowledge of etiquette "
we choose to sta in the hotel restaurant as it had a good review on iens and on tripadvis 
"set in lovely surroundings this trattoria unfoortunately is simply average and given the final bill even overpriced. it has a a very average choice of items on the menu, all of course based on the italian cuisine. we selected a 4 course surprise menu but afterwards kind of regretted our choice: unspectacular grilled tuna, followed by an average pasta and mediocre steak. there seemed to be a lot more attractive items on the menu but we didnt taste those and hopefully they are prepared with more passion and ingenuity than what we were served. the staff is very kind though, perhaps a little popular, and the wines were really nic "
we selected this restaurant because it offered a different menu than what we usually find in the dutch restaurants in this region. it was also one of the few italian restaurants whose main menu item is not piz 
went to this restaurant based on reviews / ratin 
lucca is located overlooking the elburg harbour. i had noticed the restaurant some time ago and was excited that we could now enjoy true authentic italian food. the restaurant is nice but the food was somewhat disappointing. it was missing that wow factor.
my pizza was extremely salty. it tasted extremaly bad. my friends took calzone and it also tasted very poorly. big portions but it was so bad that i ate less than half. i do not recommend this restaurant. moreover the waitress was not nice.
"proseco foscari, stale, no bubles from what appears to be some from ope left over. bottle. minuscule portion of ravioli, oily, tasteless. 8 pieces, 10, luckwarm, oily and tasteless. menu 15, but charged 16.50. seafood pasta, a lot of spahetti, many shells but some with nothing in it, empty shells. oily, little taste. very limited menu, no pizzas. dutch beers not available. one of the worse dining experience and we left halfway, paying a hefty bill for what was in essence not good food and way too expensive in comparisson with pro eran restsurant near by. they will not see me again."
"the salmon filet was but skin and bones, and when we brought it to the attention of the waitress she said shed tell the cook. there was no response until the cook-owner came by and my husband mentioned again that the salmon was very tough and primarily bones. the owner then reacted in a very unprofessional way: he lost his temper and grabbed all of our plates away - even the half eaten one of our elderly mother, who was protesting that she wanted to finish her food. to no avail. the other people next to us were so shocked by witnessing this that they said they would never come back again. we have never had such an awful experience befo "
"this used to be a nice restaurant, the last delivery was so bad. it took over 90 minutes for the delivery, and not only did we get wrong order, it was also disgusting. be aware if you ordered here before, it has become a low budget restaurant with very bad service and quality. don’t make the same mistake as us thinking they made good pizza’s, unfortunately this is not the case anymore. also they did nothing to solve the problem, people move on to the next restaurant to find your pixza."
"we ordered 2 calzone for delivery on 13-12-2021. they arrived and while the first few bites were ok, in the middle it was completely cold. just little unmelted square blocks of cheese. we called to complain and were offered replacements, but to be truthful after eating almost half there was no point in starting another. i asked if we could have a credit for next time, but that was not possib "
"good taste, good price, good service but . "
"this is a horrible time to own a restaurant. the government restrictions on gatherings means closure for the restaurant world. what is left is take-away or home delivery. i have chosen the latter three times since the summer from fratelli voorburg, the latest being yesterday eveni "
food good but the service was so slow.we waited for nearly an hour for our starters. i would recommend the for atmosphere and food.
"reservation made but when we arrived staff were not interested! however there were plenty of available tables. it is somewhat confusing that there is a fratelli i and fratelli ii restaurant side by side! food good, service average. incorrect bill presented at the end of the meal."
"fratelli is a good italian restaurant. the staff is friendly and the service is good. we tried the pizza and it was also good. conclusion: fratelli is a good, but nothing of special italian restaurant"
