"i always order delivery for this bussiness. from all the orders throughout the year. i think there has only been one order that was delivered with all the add ons as i ordered. i thought after two months or so, i give it another try. i never posted a review.today was the last straw, the two pizzas i ordered one was correct. the second pizza was once again not the one i ordered, a conpletely different one. i contacted the company: i requested the correct pizza for free this time, maybe not to friendly. they did not agree to that since they have no registration of the previous incorrect orders, despite them once having given me a free order after an earlier debacle. might be because i order without an account. a dessert was offered, i refused that. now i got the correct order, however still with a spice i specified not to add. once you get the pizza the quality is good, but okay considering pricing. for me this was the straw that broke the camels back for the delivery option. i dont know if they give the wrong order to the delivery person or that it already goes wrong when reading the order.i am just one customer, but how unlucky can you get? i used to recommend this pizzeria to friends and family, but i will no longer do so."
"pizzas are excellent. atmosphere is fine, seeing the wood oven is nice. air quality inside is poor, the space is also noisy, hard to hear each other in a group of s "
very bad and aggressive owner !!!! bad food and sour peppers 🌶  and he got mad because if it crazy never seen this before!
"we were looking for a place to eat after visiting the local museum and were pointed to this place. its a small, but cozy restaurant and we ordered pizzas, tortellini and spaghetti. we shared two caprese salads. service was friendly and the house wine was good. the pizza i had (formaggi) was exactly how it is supposed to be: crunchy and thin with different kinds of fresh cheese. we couldnt resist the desserts (home made tiramisu, a chocolate dessert and two dona biancas) and they were definitely worth the calories! we finished with espressos and were offered a limoncello of the house: excellent! recommended!"
"cucina elena is located in vleuten, very close to vleuten train station. this is not a place for tourists but for locals who are either regulars or candidates to be regulars. we arrived at cucina at 17:35-17.40 and ordered 2 pizzas. we got our pizzas at 18:00. for a place which only has 4 tables inside (1 of them was empty when we ordered), this is really really long. the place is quite small so on a cold day, it might be chaotic with all the people who wait inside and there is no place to move, also for the staff. we arrived home and the pizzas are already got half-cold (we traveled by car for 6 minutes) . the crust around the pizza was so hard it was breaking and hurting your mouth when you bite. last but not least, according to the quattro formaggi description, i was expecting to taste gorgonzola which i did not at all. actually all i could taste was simple cheese "
nice restaurant to go to with your children and family. good italian food. easy close by parking. saturday live music and lively atmosphere.
the place located by the shopping center in vleute 
"this location (maarssen) did not answer the phone, twice. then tried to order online. in my basket each pizza is suddenly €1.50 more expensive than listed. then tried calling the paid number. it asked my zip code to then bluntly tell me there is no location near me (seriously?) and hung up on me. congratulations with the worst customer service experience we had in a long time. "
"awefull pizzas, tastes horrible.  better of going somewhere else. i can make a better pizza with a tomato and some cheese"
i normally have heard great things about this pla 
"we were recommended this place and were disappointed. pizza (margherita) was mediocre at best, and wasnt cheap too. some slices didnt have any cheese on them, just tomato sauce."
ordered a pizza with tuna. bottem was very soft and the topping poorly. tomato sauce tasted very artificial. something from a jar. asked for garlic on my pizza. they dont have that. rather strange for a pizzeria.
family visit with two ki 
"dirty tables, very slack service and a few of the courses featuring on the menu where not available, such as the small pizza. seems this could not be made, only the large version ? quite incomprehensable. however worst thing was getting sick later that evening with all the symptoms of food poisoning.not recommended"
"first of all, food was great. service took a while but didn’t affect the mood too much. would’ve given a 5 purely for the pizza! perfect mix of mushroom and spinach proper got my taste buds going. this good feeling was rapidly destroyed when we went to pay and encountered mutton chops(man behind the till). if you’re not familiar with the term then google it. he was very rude. laughed at me because i’m english. stared at me for quite some time without saying a word. mutton chops, if you’re reading this then you really need to sort out your attitud "
"we waited patiently for at least 20 minutes in front of the counter but were totally ignored by the staff walking back and forth numerous times. no hellos, how many people do you have etc. nothing. not even eye contact was made with us. they then inexplicably proceeded to serve people who arrived later than us. needless to say that we left without eating as the arrogant service shown by the staff shows that this restaurant is not worth our time and money."
"not quite sure if they have a shortage of menu cards, but when we asked for one, we were told to ask the people at another table for one!! the restaurant was almost full inside and very hot and smelt very fishy, so outside it was, luckily it warmed up and it was pleasant to sit there.when we finally got hold of a menu, and ordered, the food was good. my husband had lasagne, my friend, scampi in garlic butter, and mine was a delicious goat cheese salad. the food was very good, the service a bit less, but maybe they just had too much work. we intended staying for dessert, and once again asked for a menu, as there were none around, but that did seem to be a problem, so when no menu arrived, we decided just to get the bill instead and left."
"we were looking precisely for a good italian resto in sluis and mineral had best marks on tripadvisor. it looked pretty good at the beginning and was full of people (most ordering pizza). in fact, we got self made sparkling water (6,5 euro/bottle.. ); tomato soup was a disaster (too hot, with too much salt and huge pieces of tomatoes - obviously from cane); pasta was ok (i would give 6 points from 10); but service made it all.. young lady who served us was tired and definitely not interested in tips, she simply picked the order, delivered food without any word, ignored coffee and bill (though she confirmed the order, we never received our espresso and i had to go to the bar to pay dinner myself). nothing to be added, we will not come back. "
first vist to sluis for me for 20 years. never bothered to go back as it was just very small with lace and porn sho 
"ordered “kip pikant” at the office we noticed that the chicken was smelling strange (sour)... we returned to the shop and complained. no real excuse was given, only some other sandwiches were given in return "
quite a nice restaurant. the pasta dishes are not overwhelming. meat and pizza is very good. in summer time they have a nice out door area where its very cosey. ideal for some nice evening when it is not to hot.
"never had pizza like this, so grea "
"the waitress was touching the pizza with his hands to see what is under the pizza on the plate. no rules for higiene. when i said to him i wont eat this pizza that you were touching with the unwashed hands, he said that the pizza was not for me and brought it to another person :))) not professional:"
"nice atmosphere and staff, but i would not go here if you are not a tiny person or cant afford to buy two main dishes. 80 grams of fish, and 100 grams of baked vegetables at a price of €17,-. fries cost €6,50 on top. the seasoning was nice, however."
i had high hopes for this place after reading reviews and looking at the photos on the websit 
nice location and ambiance but the rest was really dissapointing. the food was not even close to the italian foo 
"a family italian restaurant, not so bad. food was ok, but the place is really oldated. prices are reasonable"
"ok. pizza is sick and soggy and very salty. parmigiana was very disappointed , aubergine was no fried, like a water🙈 no fresh herbs, without fresh basilicum it is not a real deal.. most of the dinner went to the garbage.. we had a bad tummy in a half hour.. shame… not anymore "
"we had dinner with friends. i found this to be a nice place, but i found the food to be average. service was good, the limoncello was not as it should (it was made with vodka) and the feeling in the dinning area is that you are in an old restaurant needing a rebuilt to give it a fresh look. you will not be disappointed if you eat there, but you wont be excited either."
"bad service, terrible pizza, expensive .  pizza dough was either burnt or soggy. the air spray was so overwhelming that even the water tasted of it. very expensive for very very bad pizza and terrible service."
"first visit to this restaurant and a little bit disappointed despite the fact that the waitresses were nice. our entree/amuse was forgotten (!); you dont aks for it, though. the service was slow. the terderloin, i ordered was indeed from the grill but, in the middle red and absolutely not medium cooked. i mentioned it, but it was too late to be returned to the chef (which i understood). as a compensation i was offered a free drink, which was nice though. my partner had the tagliatelli with sea fruits. that was nice!."
opening hours not accurate. it states this restaurant is open to 21:45. we arrived around 20:40 and they said they were closed. very disappointing but on the positive side we then stumbled across groucho’s which was amazing and serves food till late! we arrived well after 21:00 and made very welcome by all staff. we’ll be back!
"this is a beautiful place to see, the architecture, the walk to the orangerie. and we had a great time at the wedding too."
"food is great, service inexperienced but friendly. problem was that is took way too long before food was serv "
"to be fair, we ended up in this restaurant on the worst night possible, carnival with the local party tent right next door. the restaurant was filled with drunk customers all dressed up for carniva "
"just another fast food place with forgettable food.not much good to say about it, limited drinks selection."
"the food although pricey was good. the drinks , to expencive.  at least offer an affordable choice.  because no carbohydrate side dish  we left hungry"
"i ordered the lasagna with a yoghurt and granola dessert along with a small latte. the lady at the till decided to charge me an extra 20 cents for a syrup in my coffee which i never asked for. the dining area was disgustingly filthy with dirty tables, uncleared finished meals and overflowing bins. dear me mr oliver. what have you put your name on here! i wanted to eat here instead of just going to mcdonalds all the time. next time ill stick to maccy ds!!"
"schiphol is lacking in proper food, just overpriced bread rolls with cheap filling. i decided to give this place a chance. the lasagne was cold, lacking in taste, and substance, just creamy mush. the tomato soup was far too overspiced, and im saying that as someone that enjoys spice. the cappuccino is effectively warm milk without any coffee taste, same as everywhere else in this airport. the price is extortionate. dont bother. in euros soup €5.50, lasagne €12.25. bottle of water €5, cappuccino €5. o yeah and paper plates and cutlery. "
"disgusting and chaotic. the simple order of sandwich and coffee was incorrectly delivered, it too ages to pay even though there was no queue, and the food was terrible. never again, a complete waste of money. jamie, get this place fixed or take your name off the door."
jamie oliver should be ashamed to have his name associated with this restaurant. the quality of the food is very poor
"food was cold, although the staff were ok. wished i’d gone to mcdonalds least it might have been hot food."
"shocking set up, incredibly slow service and rude sullen staff, who don’t seem to know how to make coffee. if you want hot food - good luck. queue for your food then queue for your drink and to pay. by the time you’ve got to the till your meal will be cold. macdonalds is probably nicer"
horrible. don’t ever come here absolutely shocking! food was horrible and the prices were appalling. wish i read the reviews first. you might as well go and get a mcdonald’s over this because it was just horrible. avoid this place at all cost.
honestly a terrible experience almost from start to fini 
"it says full breakfast... not sure what style? apparently its meant to feel familiar, but i paid the best part of £20 for watery dry beans, a solid sasauge and for some reason, there are new potatoes on my plate. spoons breakfast is better than jamie olivers by a country mile. yuck."
"avoid at all costs, food uneatable. didn’t touch it and staff demanded i paid for food that was shocking. so called woman chef was rude, threw the food at me and told me i didn’t pay when u did pay a shocking €30 for something we didn’t eat. this place needs a reality check as it’s customer service is shocking. don’t waste your money and go to mcdonald’s. very rubbish end to a good trip"
this restaurant was appalling. when i complained the staff laughed in my face. don’t go here as you definitely chance feeling sick afterwards as i did
"awful, awful food, slow service and hugely expensive. avoid. the vegetarian breakfast had some kind of clear sauce on it so the whole thing was swimming. actually made my daughter wretch. the mean one my other daughter had was not better - she said it was the worst sausage she had ever had. no porridge. dry bacon butty. jamies face smiling and saying he had good food for us, we wanted to be set up for the flight and ended up hungry and ripped off."
shocking service staff aloof at the tills and the food was practically inedible. it sounded great on menu but it’s not when it comes to your paper box. 4.15 for a soft drink bottle at least 50% more expensive than in the other already price inflated stores. they capitalise on their position being the first restaurant through the gate and clearly don’t feel the need to provide a service or product that justifies the price.
"do not eat here! there are many other places in schipol airport that will provide you with a decent meal. you will not get one here we ordered the veggie breakfast and they were missing ingredients from the breakfast such as the potatoes, it was luke warm and you are served in what i can only describe as cardboard dogbowl. and the bill was €35 for food that i can only describe as slop in a bowl! "
"shockingly overpriced, poor service and tables not clean. ordered the woodman’s sandwich, which was missing ingredients."
"waited ages to be served with food, as soon as i walked away a taller male was served, took my food to pay and get a drink, 3 people there but only 1 till on 2 iced coffees only 1 had ice, by the time i got to my table the food was cold, surprised at the 2* rating."
"absolutely disgusting here. lots of staff doing nothing while all tables are filthy, broken glass and generally disgusting. we even saw a mouse running around!!!"
so bad it’s laughable - except then you realise how much you paid for inedible food.  wish i had read the reviews first - they are all accurate.  this place needs to be closed
jamie. seriously.  16.95 euros for a tiny portion of cold gnocchi and a bottle of water. and you are putting your name to this. i’d be embarrassed
overpriced and not very efficient for a location that demands quick service.   slack about cleaning tables.
"had nicoise salad and a piece of pizza- both completely inedible. pizza a dry and stale. lettuce in salad was brown and slimy. took them both back up to the counter. the server was very unhelpful and said they couldn’t do anything. i asked for a refund and they questioned the fact that i had had a bite out of the pizza. i explained ‘yes that’s how i knew it was stale and dry!’ the server begrudgingly refunded my money, no apology at all. i have never left a negative review before and i never take food back unless completely inedible. can’t believe jamie oliver puts his name to this! "
"over priced, poor food and shocking services. 22.55 for a small breakfast coffee and water. the so called chef weighed out my spoon of egg. my advice stay clear and there’s better places to eat in the airport. what a complete rip-off jamie. you should be ashamed of yourself"
"total slop masquerading is an italian pasta dish.  no flavour, over cooked and essentially cold.  total brand distraction for mr oliver."
"everything about this place is awful, queued for 30 mins to find how dry and unappetising the hot breakfast was. opted for a sausage sandwich, e7.50, it was 1 sausage sliced into 3, in a completely dry bun, asked for butter or sauce and the staff said they had none at all and offered me jam. queued another 10 mins to pay so the sandwich was cold by the time i sat down. avoid at all costs. cannot believe this is trading."
"a few slices of dried up pizza alongside some dried up pasta was all they had. nothing else, no lasagna, not even any sparkling water. jamie should be ashamed."
"absolutely dreadful food! dry, bearly toasted cheese and ham toastie that cost e5 plus …. best of a bad choice … sadly, avoid !  however … highly recommend starbucks near gate h , fabulous sandwiches and cheaper  🙌"
"terrible in all respects. dirty table and floor. ridiculous queueing system meant that on getting to the front of the long line i was told that i had to order hot food a different counter, so that by the time i had queued again and gone back to the till the food was cold. breakfast “sandwich” was disgusting and the coffee tasted like dish water."
would not come back - family of 3 was 40 euros for cold food - not the quality expected at all :( still starving 🥹 first bad meal we have had in holland
really unpleasant breakfast - trying to be high end and charging high end prices but done terribly. rock hard sausage with cubes of scrambled egg with some crusty rosemary thrown on in an attempt to justify the price.
awful breakfast in a bowl. long wait to pay by which time poor quality food was cold.  dont have  high expectations for airport food but for 45 euro expect it to be edible. had a better breakfast out a tin
"absolutely disappointing. we went there as we both like jamie‘s dishes. but what you get there is a bad joke. pasta that tastes like nothing, pizza that is only oily. lots of stuff not on stock, employees highly unmotivated. better go downstairs to the „bread“ bar, here the food looked fresh and tasted as expected. "
we sewed the name and went i 
"paid €40 for food served in a cardboard bowl a teaspoon of scrambled egg, a sausage, rock hard bacon (ordered toast but didnt receive it) it was cold and looked awful. asked for the manager who couldnt be found so requested a refund. unbeknownst to me the table next to mine was also requesting a refund. our details were taken and i am still waiting 2 weeks later. cannot get hold of anyone to speak to and airport cannot help 🤷🏼‍ "
"the sausages are lovely but food so expensive charged for every item such as butter , sauces…. staff very slow and ignored us while they chatted among themselves"
"had a meal before flight home, medium bowl of mushroom pasta was bland, mushy and cost 8 euros, coke 5 euros, have had tastier pot noodles but was hungry so ate it, come on jamie, thought you were trying to get people to save money on food ! not this time"
prettt poor venue. staff not clearing table and left rubbish everywhere. half the food unavailable or looking like it had seen better days.
"my wife is a fan of jamie oliver and we was very excited to eat there. but the food was terrible without flavor. we order an aubergine parmigiano. the presentation was bad, but even worse the flavor. we also order a sandwich that was so simple. it was a very disappointing experience."
"only one member of staff to serve a queue of over twenty people. i joined with only four people ahead of me and that took twenty minutes. many people joined after. many people complaining of cold food as you have to collect your food first, then wait in a queue to pay. glad i only had coffee. once seated it was easy to see the tables had not been cleaned for hours and bins were overflowing. disgusting. wish i’d gone to starbucks. will never go to a jamie oliver again."
"terrible food quality. had the pasta bolognaise m, no flavour at all. taste like basic brand pasta sauce.  jamie oliver you should be ashamed to put your name to this place, but wealth and greed are the drives you more."
"terrible.  worse food ever.  no favour, tepid and soggy.  whole restaurant filthy with no one to clear tables.  would really avoid this restaurant at all cost."
has to be the wor 
"none of the tables were cleaned or cleared. customers had to clear tables themselves. the food is so basic, pasta (very plane) 2 choices of overpriced pizza, very tiny basic salads. bad coffee. i didn’t have a beer but they at least looked ok. there isn’t much choice of food in the airport but honestly mcdonalds would be better and 1/2 the price so just go there. jamie take your name off this shambles of a place or improve it!"
"absolute rip off for what it is, like microwaved pasta actually shop bought ones are nicer got lasagne just sheets of pasta no mince"
"can’t believe jamie oliver put his name to this restaurant. complete waste of money. really basic food, served badly."
"you would hope to get a decent feed when jamie oliver puts his name and face on a food outlet. i realise im in an airport, past security but still. "
"bad tempered staff, the worst, soggy bolognese pasta with no flavor at all! what does the name jamie oliver stand for? for the extortionate prices? money wasted, unfortunately :(("
mushroom pasta inedible- smelled and tasted like burnt garlic and cold by the time you have paid. same some years ago when it first opened but i had hoped for improvement- pity.
jamie oliver should be embarrassed having his name above the door. i had the mushroom pasta. no taste and the sauce was like water. also the pasta was over cooked. i expected so much more. what a let down jamie.
i had the misfortune to have a jamie’s deli breakfast yesterday morning at shiphol airpo 
"no one at the counter when i arrived, when called, refused to come to help me & a colleague came in his place. the ham & cheese toastie wasn’t great & the iced coffee was pretty dire. at 20 euro for those +a muffin & cappuccino, we were less than impressed"
"overpriced, pasta salad with no flavour. couldn’t even provide me with a wine glass for my overpriced wine. no staff cleaning tables. was forced to eat here as arrived in airport after 6 pm and unfortunately was the only option."
"at 17:30 they’d run out of some food. no trays, filthy tables, lacklustre staff apart from one kind soul who offered me her tray from behind the ba "
don’t waste your money here £3 for a measly 50gram of salad  we spent 24 euro on a coffee and two snacks  absolute joke jamie sort it out please!!!!!!!
"i visited jamie’s deli on sun 28th aug at 19-07 the queues were average i ordered pasta with mushrooms and a piece of margarita pizza the pasta came out of a new;y prepared dish in which i thought would be piping hot it wasn’t after queuing for almost ten minuets for a drink and to pay when i got to my table it was only aired there was only two staff on the counter taking payments serving coffee and drinks which was not enough,i think jamie oliver should visit his deli in disguise to sample the excuse for food and service i paid euros 29.70 with a drink i think if jamie oliver sees this review he should refund my money."
"this place is a disgraceful rip off, with shocking quality food & non-existent customer service. the breakfast €14.95 was all lumped into a bowl and did not include toast or tea/coffee/juice. they provided 4 slices of toast and charged us €16 extra - they would not provide more that 4 small butter servings. a small bottle of water was €5.10 & we were treated like criminals because they claimed we didn’t pay for 3 slices of toast. it’s disgraceful & embarrassing for jamie oliver to put his name to this. do not support this restaurant."
this was really poor. the food was really low quality and the aubergines were like eating rubber. really disappointing.
"alas the porridge, usually a safe bet for vegans, has cow’s milk in it. they offered to serve me the vegetarian breakfast without the eat but i was not in the mood for a heavy full english style breakfast. they do have non-dairy milks for tea and coffee."
"it’s the first thing you see when you enter the departure hall at schiphol. my advice: walk past  it and look for something good. it was quite disgusting. dirty trays, bad food, not very friendly. waste of money."
"€8 for one small piece of pizza that tastes like it has been sat out for an hour. service is terrible, staff look at you like you are inconveniencing them. avoid!"
