"i ordered the lasagna with a yoghurt and granola dessert along with a small latte. the lady at the till decided to charge me an extra 20 cents for a syrup in my coffee which i never asked for. the dining area was disgustingly filthy with dirty tables, uncleared finished meals and overflowing bins. dear me mr oliver. what have you put your name on here! i wanted to eat here instead of just going to mcdonalds all the time. next time ill stick to maccy ds!!"
"schiphol is lacking in proper food, just overpriced bread rolls with cheap filling. i decided to give this place a chance. the lasagne was cold, lacking in taste, and substance, just creamy mush. the tomato soup was far too overspiced, and im saying that as someone that enjoys spice. the cappuccino is effectively warm milk without any coffee taste, same as everywhere else in this airport. the price is extortionate. dont bother. in euros soup €5.50, lasagne €12.25. bottle of water €5, cappuccino €5. o yeah and paper plates and cutlery. "
"disgusting and chaotic. the simple order of sandwich and coffee was incorrectly delivered, it too ages to pay even though there was no queue, and the food was terrible. never again, a complete waste of money. jamie, get this place fixed or take your name off the door."
jamie oliver should be ashamed to have his name associated with this restaurant. the quality of the food is very poor
"food was cold, although the staff were ok. wished i’d gone to mcdonalds least it might have been hot food."
"shocking set up, incredibly slow service and rude sullen staff, who don’t seem to know how to make coffee. if you want hot food - good luck. queue for your food then queue for your drink and to pay. by the time you’ve got to the till your meal will be cold. macdonalds is probably nicer"
horrible. don’t ever come here absolutely shocking! food was horrible and the prices were appalling. wish i read the reviews first. you might as well go and get a mcdonald’s over this because it was just horrible. avoid this place at all cost.
honestly a terrible experience almost from start to fini 
"it says full breakfast... not sure what style? apparently its meant to feel familiar, but i paid the best part of £20 for watery dry beans, a solid sasauge and for some reason, there are new potatoes on my plate. spoons breakfast is better than jamie olivers by a country mile. yuck."
"avoid at all costs, food uneatable. didn’t touch it and staff demanded i paid for food that was shocking. so called woman chef was rude, threw the food at me and told me i didn’t pay when u did pay a shocking €30 for something we didn’t eat. this place needs a reality check as it’s customer service is shocking. don’t waste your money and go to mcdonald’s. very rubbish end to a good trip"
this restaurant was appalling. when i complained the staff laughed in my face. don’t go here as you definitely chance feeling sick afterwards as i did
"awful, awful food, slow service and hugely expensive. avoid. the vegetarian breakfast had some kind of clear sauce on it so the whole thing was swimming. actually made my daughter wretch. the mean one my other daughter had was not better - she said it was the worst sausage she had ever had. no porridge. dry bacon butty. jamies face smiling and saying he had good food for us, we wanted to be set up for the flight and ended up hungry and ripped off."
shocking service staff aloof at the tills and the food was practically inedible. it sounded great on menu but it’s not when it comes to your paper box. 4.15 for a soft drink bottle at least 50% more expensive than in the other already price inflated stores. they capitalise on their position being the first restaurant through the gate and clearly don’t feel the need to provide a service or product that justifies the price.
"do not eat here! there are many other places in schipol airport that will provide you with a decent meal. you will not get one here we ordered the veggie breakfast and they were missing ingredients from the breakfast such as the potatoes, it was luke warm and you are served in what i can only describe as cardboard dogbowl. and the bill was €35 for food that i can only describe as slop in a bowl! "
"shockingly overpriced, poor service and tables not clean. ordered the woodman’s sandwich, which was missing ingredients."
"waited ages to be served with food, as soon as i walked away a taller male was served, took my food to pay and get a drink, 3 people there but only 1 till on 2 iced coffees only 1 had ice, by the time i got to my table the food was cold, surprised at the 2* rating."
"absolutely disgusting here. lots of staff doing nothing while all tables are filthy, broken glass and generally disgusting. we even saw a mouse running around!!!"
so bad it’s laughable - except then you realise how much you paid for inedible food.  wish i had read the reviews first - they are all accurate.  this place needs to be closed
jamie. seriously.  16.95 euros for a tiny portion of cold gnocchi and a bottle of water. and you are putting your name to this. i’d be embarrassed
overpriced and not very efficient for a location that demands quick service.   slack about cleaning tables.
"had nicoise salad and a piece of pizza- both completely inedible. pizza a dry and stale. lettuce in salad was brown and slimy. took them both back up to the counter. the server was very unhelpful and said they couldn’t do anything. i asked for a refund and they questioned the fact that i had had a bite out of the pizza. i explained ‘yes that’s how i knew it was stale and dry!’ the server begrudgingly refunded my money, no apology at all. i have never left a negative review before and i never take food back unless completely inedible. can’t believe jamie oliver puts his name to this! "
"over priced, poor food and shocking services. 22.55 for a small breakfast coffee and water. the so called chef weighed out my spoon of egg. my advice stay clear and there’s better places to eat in the airport. what a complete rip-off jamie. you should be ashamed of yourself"
"total slop masquerading is an italian pasta dish.  no flavour, over cooked and essentially cold.  total brand distraction for mr oliver."
"everything about this place is awful, queued for 30 mins to find how dry and unappetising the hot breakfast was. opted for a sausage sandwich, e7.50, it was 1 sausage sliced into 3, in a completely dry bun, asked for butter or sauce and the staff said they had none at all and offered me jam. queued another 10 mins to pay so the sandwich was cold by the time i sat down. avoid at all costs. cannot believe this is trading."
"a few slices of dried up pizza alongside some dried up pasta was all they had. nothing else, no lasagna, not even any sparkling water. jamie should be ashamed."
"absolutely dreadful food! dry, bearly toasted cheese and ham toastie that cost e5 plus …. best of a bad choice … sadly, avoid !  however … highly recommend starbucks near gate h , fabulous sandwiches and cheaper  🙌"
"terrible in all respects. dirty table and floor. ridiculous queueing system meant that on getting to the front of the long line i was told that i had to order hot food a different counter, so that by the time i had queued again and gone back to the till the food was cold. breakfast “sandwich” was disgusting and the coffee tasted like dish water."
would not come back - family of 3 was 40 euros for cold food - not the quality expected at all :( still starving 🥹 first bad meal we have had in holland
really unpleasant breakfast - trying to be high end and charging high end prices but done terribly. rock hard sausage with cubes of scrambled egg with some crusty rosemary thrown on in an attempt to justify the price.
awful breakfast in a bowl. long wait to pay by which time poor quality food was cold.  dont have  high expectations for airport food but for 45 euro expect it to be edible. had a better breakfast out a tin
"absolutely disappointing. we went there as we both like jamie‘s dishes. but what you get there is a bad joke. pasta that tastes like nothing, pizza that is only oily. lots of stuff not on stock, employees highly unmotivated. better go downstairs to the „bread“ bar, here the food looked fresh and tasted as expected. "
we sewed the name and went i 
"paid €40 for food served in a cardboard bowl a teaspoon of scrambled egg, a sausage, rock hard bacon (ordered toast but didnt receive it) it was cold and looked awful. asked for the manager who couldnt be found so requested a refund. unbeknownst to me the table next to mine was also requesting a refund. our details were taken and i am still waiting 2 weeks later. cannot get hold of anyone to speak to and airport cannot help 🤷🏼‍ "
"the sausages are lovely but food so expensive charged for every item such as butter , sauces…. staff very slow and ignored us while they chatted among themselves"
"had a meal before flight home, medium bowl of mushroom pasta was bland, mushy and cost 8 euros, coke 5 euros, have had tastier pot noodles but was hungry so ate it, come on jamie, thought you were trying to get people to save money on food ! not this time"
prettt poor venue. staff not clearing table and left rubbish everywhere. half the food unavailable or looking like it had seen better days.
"my wife is a fan of jamie oliver and we was very excited to eat there. but the food was terrible without flavor. we order an aubergine parmigiano. the presentation was bad, but even worse the flavor. we also order a sandwich that was so simple. it was a very disappointing experience."
"only one member of staff to serve a queue of over twenty people. i joined with only four people ahead of me and that took twenty minutes. many people joined after. many people complaining of cold food as you have to collect your food first, then wait in a queue to pay. glad i only had coffee. once seated it was easy to see the tables had not been cleaned for hours and bins were overflowing. disgusting. wish i’d gone to starbucks. will never go to a jamie oliver again."
"terrible food quality. had the pasta bolognaise m, no flavour at all. taste like basic brand pasta sauce.  jamie oliver you should be ashamed to put your name to this place, but wealth and greed are the drives you more."
"terrible.  worse food ever.  no favour, tepid and soggy.  whole restaurant filthy with no one to clear tables.  would really avoid this restaurant at all cost."
has to be the wor 
"none of the tables were cleaned or cleared. customers had to clear tables themselves. the food is so basic, pasta (very plane) 2 choices of overpriced pizza, very tiny basic salads. bad coffee. i didn’t have a beer but they at least looked ok. there isn’t much choice of food in the airport but honestly mcdonalds would be better and 1/2 the price so just go there. jamie take your name off this shambles of a place or improve it!"
"absolute rip off for what it is, like microwaved pasta actually shop bought ones are nicer got lasagne just sheets of pasta no mince"
"can’t believe jamie oliver put his name to this restaurant. complete waste of money. really basic food, served badly."
"you would hope to get a decent feed when jamie oliver puts his name and face on a food outlet. i realise im in an airport, past security but still. "
"bad tempered staff, the worst, soggy bolognese pasta with no flavor at all! what does the name jamie oliver stand for? for the extortionate prices? money wasted, unfortunately :(("
mushroom pasta inedible- smelled and tasted like burnt garlic and cold by the time you have paid. same some years ago when it first opened but i had hoped for improvement- pity.
jamie oliver should be embarrassed having his name above the door. i had the mushroom pasta. no taste and the sauce was like water. also the pasta was over cooked. i expected so much more. what a let down jamie.
i had the misfortune to have a jamie’s deli breakfast yesterday morning at shiphol airpo 
"no one at the counter when i arrived, when called, refused to come to help me & a colleague came in his place. the ham & cheese toastie wasn’t great & the iced coffee was pretty dire. at 20 euro for those +a muffin & cappuccino, we were less than impressed"
"overpriced, pasta salad with no flavour. couldn’t even provide me with a wine glass for my overpriced wine. no staff cleaning tables. was forced to eat here as arrived in airport after 6 pm and unfortunately was the only option."
"at 17:30 they’d run out of some food. no trays, filthy tables, lacklustre staff apart from one kind soul who offered me her tray from behind the ba "
don’t waste your money here £3 for a measly 50gram of salad  we spent 24 euro on a coffee and two snacks  absolute joke jamie sort it out please!!!!!!!
"i visited jamie’s deli on sun 28th aug at 19-07 the queues were average i ordered pasta with mushrooms and a piece of margarita pizza the pasta came out of a new;y prepared dish in which i thought would be piping hot it wasn’t after queuing for almost ten minuets for a drink and to pay when i got to my table it was only aired there was only two staff on the counter taking payments serving coffee and drinks which was not enough,i think jamie oliver should visit his deli in disguise to sample the excuse for food and service i paid euros 29.70 with a drink i think if jamie oliver sees this review he should refund my money."
"this place is a disgraceful rip off, with shocking quality food & non-existent customer service. the breakfast €14.95 was all lumped into a bowl and did not include toast or tea/coffee/juice. they provided 4 slices of toast and charged us €16 extra - they would not provide more that 4 small butter servings. a small bottle of water was €5.10 & we were treated like criminals because they claimed we didn’t pay for 3 slices of toast. it’s disgraceful & embarrassing for jamie oliver to put his name to this. do not support this restaurant."
this was really poor. the food was really low quality and the aubergines were like eating rubber. really disappointing.
"alas the porridge, usually a safe bet for vegans, has cow’s milk in it. they offered to serve me the vegetarian breakfast without the eat but i was not in the mood for a heavy full english style breakfast. they do have non-dairy milks for tea and coffee."
"it’s the first thing you see when you enter the departure hall at schiphol. my advice: walk past  it and look for something good. it was quite disgusting. dirty trays, bad food, not very friendly. waste of money."
"€8 for one small piece of pizza that tastes like it has been sat out for an hour. service is terrible, staff look at you like you are inconveniencing them. avoid!"
"the gluten free options were very few and what was available was just poor, the staff although helpful didnt seem to know what was available. so i had to try to work it out for myself and have another salad lol i think jamie needs to have a look at this outlet and get a grip of things. the others in our group were only slightly less disappointed than i was."
food was terrible overpriced and service hopeless.  should have gone to mcdonalds next door.  trading on jamie’s name - jamie should disown this place.
jamie’s deli is directly opposite the exit from security. we arrived there at 1pm. lunchtime 
don’t waste your time or your money. the food is awful (like jamie oliver) and you have to be lucky to get a choice without having to wait 30 minutes.
a complete nightmare. by the time you have waited to pay your food it is cold. if you want to go back for a drink you have to wait another 30 mins.
"a total waste of my and my partners time. waited half an hour, with only one staff member on the tills doing the coffee and taking orders which was at 6 am which was the morning rush in the airpo "
"menus at entrance does not depict what they actually have. slowest line ever. 4 people behind the counter but apparently only one taking orders, taking money and making the coffee!!! very inefficient. we through out the iced coffee, the ham and cheese baguette had a pungent translucent onion we scrapped off .. other than that it was fine"
"visited several times recently, service is terrible, unhelpful staff and illogical queuing system, cold overpriced food by the time you actually pay for it. the place is beyond dirty, appears to not be cleaned throughout the day."
"im very disappointed with the whole experience at jamie oliver at schiphols airport. it has only the name. cold coffee, hard aubergine with wood cutlery which was impossible to cu "
avoid at all costs. dirty tables everywhere and staff chatting behind the corner. queried why my large coffee only filled 2/3rds of the cup and was told very rudely that it wasnt their problem. they then stood laughing. very unpleasant experience.
"awful. slow service, rude staff and messy, dirty trays and tables. avoid at all costs and someone please tell jamie to quit racking in the cash and spend more attention insuring anything with your name to it is up to standard"
"tables not cleared.  crumbs everywhere.  poor choice of food and what there was was poorly served.   people hogging tables; but not eating  jamie,jamie.  is this really what you envisioned…?"
"poor choice of food and honestly the pizza was terrible, very hard crust (probably old) and not so tasty. i would have expected more from a jamie franchise. would not recommend it"
"just terrible in every way. horri le food, miserable choice, inept staff, dirty. hard to fathom why this version of jamies franchises didnt also go bust, other than the absolute lack of choice in such a big airport (mcdonalds the only other at 1930 on a weekday...)"
"dirty, expensive and long waiting for a simple coffee. nobody comes around to check or clean the tables."
"o my goodness, that was the slowest service ever, 8 people working but you got feeling like is only 1 there, no one do anything. jamie for f..k sake its"
"oh dear . what a shocking disappointment- by the time the food on the paper plate was placed in front of me - it was luke warm at best. i seriously expected better than this. it was a toss up between them and their neighbours mcd- i thought that i would get better quality at jamie’s. sadly, i was so wro "
"only one thing actually offered on the menu and it was a gross, sloppy pasta. had to queue unnecessarily for over 15 mins which made the food cold. also was charged €5 for a bottle of water and the staff were rude. awful."
"overpriced, poor food selection, extremely dirty, uninterested slow staff and not at all tasting. i am no fan of mcdonald’s but in this case you should go for this instead which is right across."
"waited in queue for atleast 40 minutes, there were only four staff working, one making sandwiches, one cooking, one at payout and the fourth mostly just stood around doing nothing - time to time plating some foo "
"schipol is not great for dining at the best of times, but this is exceptionally bad. utter chaos, tables rarely cleared, uninterested staff, and terribly over priced. 11 euros for soggy, chewey pasta, 9 euros for some generic burnt carbohydrate (possibly pizza). a fitting end of the line to jamies restaurant empire. avoid at all costs"
"simply terrible by jamie oliver is what it should be called. the food for start is very over priced, if you manage to get over that fact the food is served while you are in the queue but the you have to wait while they make peoples coffees before you can pay and by that time our breakfast was now cold. they should have a designated pick up are for coffee/tea so they queue can keep moving. however the food is of a very poor standard. the sausage with the breakfast was extremely dry, why jamie oliver would want to put his name to this i do not know. go to mcdonald’s or something would even be a better choice than this."
skip th 
well what can i say..i had the lasagne...well it was left as it was dry and no meat and all pasta..no taste to it what so eve 
"sadly a big lie. promises all good stuff and no nasties but the hot breakfast was nasty and bad. scrambled egg looks like porridge and tastes nasty as does the sausage. to salty. the logistics also need work. prices are high what is no surprise, especially at an airpor "
for some reason loads of places were shut in schiphol when were travelling back so there wasnt much choice other than this or mcdonald 
chose this over mcdonalds (only other choice). pasta was cold & virtually inedible. salad was 2 spoonfuls & not great. pizza was even worse. total waste of money. beer was lovely & cold & only good thing about the experience! otherwise wouldnt even give it one star.
"there seemed to be only a choice of mcdonalds or here on the day so we opted for this thniking the food would be better. how wrong could we be? two dreadful, tastelesss small plates of mushroom pasta and a slice of horrible, burnt pizza. two tiny (200ml) orange juices, 11 euros for those. bottle of water at 4.95 euros. total just under 50 euros for the worst meal i think i have ever had when travelling. very cynical not to put prices on the drinks and then to overcharge so ruthlessly."
-1. absolutely disgusting only us in queue waited 15 minutes to order breakfast then 15 minutes to pay by this time good was stone cold. we requested a replacement meal. food was disgusting and just slapped on cardboard plate. staff so slow and more interested in eating own breakfast. masks being worn on chin not covering mouth or nose. tables dirty.
truly disgraceful portions and price. cannot believe that jamie oliver would condone this if he knew. image of double portion of salad. (very tasty though)
a portion of pasta salad was literally two pieces of greasy penne and an olive and two bits of tomato. staff unfriendly and its so overpriced for the portions. cant believe jamie oliver put his name to this. i came here because i thought it would be tasty and well prepared. so disappointing. do not eat here.
"ok, so the pandemic has meant the travel industry has taken a huge hit with low traffic/travellers but this restaurant was embarrassing! it was six oclock in the evening & the selection of food was non-existent or dried up! the only food for a gluten free diet was a dried up salad, the lasagne my husband ate in desperation looked like it had been out since 10.00am. truly awful! the floor & tables were grubby & the staff half asleep. you have to wonder whether jamie oliver would eat there!"
slow service. sleepy atmosphere. nothing to as jamies says kick-start your morning. poor food and quite pricey. i asked few times for a sandwich that takes 30sec to make. avoid.
departure area 3. poor cappuccino and sickly brownie for more than 8 euros. only place open for coffee so  not much choice. slap your name on any crap. i seem to remember eating here a couple of years ago and it was lousy then too.
"we had a morning flight so chose to eat at the airport. i ordered a bacon bap but unfortunately after eating a mouthful, i discovered it had onions in it! i have a reaction to onions which makes my body swell and i get intense stomach ache. the menu did not say the item contained onions!"
"i ordered a pizza,and got piec of dried bread.i could hardly cut the pizza with the plastic fork.this place was a huge disappointment."
"it was overpriced like all the other food on airports. the veggie breakfast bowl i got was okay, but the bacon sandwiches were disappointing: a bun with 2 strips of bacon and some sautéed onions. they also have smoothies which they make to order and pre-made baguettes with ham&cheese, mozzarella, chicken, etc. not worth it to come by here!"
i wish id read some of the reviews beforehand. the restaurant itself looks ok but thats as far as it goe 
"fly here a lot thought i’d try some where new. tried a slice of pizza, very little cheese tomato sauce and pepperoni for 8 euro what a joke another rip off place!!  i would not put my name to this place won’t be coming back!!!"
insane prices worst quality. just skip this please if you can. the owner of this place is only there to make you lose money without doing anything
expensive spot in the airport for some last minute food.. nothing special altho it gives the look of a more upmarket establishment
"made the mistake of reading the reviews after ordering! this was the most expensive meal we had in amsterdam and by far the worst. €40 for 2 breakfasts including a €5 bottle of water - i realise food at airports is generally more expensive but i do not see how this is justified. dirty tables because staff are so busy serving customers, other reviews mentioned rude staff but i must say we did not encounter this. food was not bad, but i believe you should get what you pay for and this was not even close to a €40 meal."
"this is easily the absolute worst place i have ever eaten. the tables had lively lamps on them, but were caked in dust. i mean just absolutely covered. as if someone had just found them in their grandparents basements after 50 years being in there. wipe the things. thats all i ask. and they are on the table that you eat at, thats whats so ba "
lasagne good but small porti 
"can i give no stars? never had to before. looks like prison food, £30 for the privilege. waited 25 mins for slop. hideous. walk on by. how does jo put his name to this crap!!! didn’t even get all items!! probably a blessing."
"terrible place! poor service, moody and careless staff borderline with rudeness. the place stop serving breakfast at 10:30 am. a total waste of a prime space."
"i came here for a pasta salad, which was the cheapest item on the menu. tasty enough and plenty of seating area. experience was slightly ruined when i saw a mouse scurrying under one of the tables...bit worrying at an airport?"
